Event Name;Category;Description;Time;Date;Venue

ThinkerNet;Competitions;Develop ideas in one of the hottest sectors in technology of our times;17:00;03/01/2015;SOM
NextGen TV;Competitions;Tell us, with technological advancement, what will the television become;17:00;03/01/2015;Lecture Hall
Codeblitz;Technocalypse;Buckle up and crack the code!;17:00;03/01/2015;FCK
Vortex;Technocalypse;Assist the troop in reaching out to the enemies secretly;17:00;03/01/2015;FCK
Mechatron;Technocalypse;Establish the broken bridge to enter the Zion city safely;17:00;03/01/2015;FCK
